<!ELEMENT eventslinks (event, context)>
<!ELEMENT event (terminologyName, eventType,predicate, value)>
<!ELEMENT terminologyName (#PCDATA)>
<!ELEMENT eventType (#PCDATA)>
<!ELEMENT predicate (predicateType)>
<!ELEMENT predicateType (#PCDATA)>
<!ELEMENT value (#PCDATA)>
<!ELEMENT context (value)>
